{"schema_version": "1.0.0-proposed", "run_id": "threereal-online-20261019T155522Z", "request_id": "legal-threereal-online-20261019T155522Z", "event_id": "comm-fdf002478b7a4a638d2cfc6ec9a542d3", "producer": {"name": "member1_rospace_comm", "source": "EXTERNAL", "module_version": "0.3.0"}, "observed_at": "2026-10-19T15:56:20.482524+00:00", "status": "UNKNOWN", "reason": "MODEL_NOT_ACCEPTED_OR_UNTRUSTED_OBSERVATION: normal prediction withheld", "communication": {"resource": "/rg/guarded_navigate", "resource_type": "Action", "operation": "GOAL_SEND"}, "window": {"start": "2026-10-12T11:59:55Z", "end": "2026-10-12T12:00:00Z", "duration_ms": 5000}, "request_count": 12, "anomaly_category": "UNKNOWN", "risk_level": "UNKNOWN", "basis": ["Offline classification only; RUNTIME_MONITOR: NOT_READY", "trusted_observation_provenance=UNKNOWN", "envelope_observation_kind=RUNTIME_LOG", "MODEL_NOT_ACCEPTED_OR_UNTRUSTED_OBSERVATION: normal prediction withheld", "model_sha256=d45d272eea9dfef67b2b0066af0fd078270d559a4a4e350b7558d072c21c40df", "5 explicit null values: train-only median imputation; absent feature names are rejected"], "evidence_refs": [{"ref": "tests/fixtures/member1/rospace_comm_rows.json", "kind": "RUNTIME_LOG", "note": "real held-out ROSPaCe rows; offline classification input"}], "extensions": {"member1_comm": {"algorithm": "numeric-model", "score": 0.18208717770361058, "model_sha256": "d45d272eea9dfef67b2b0066af0fd078270d559a4a4e350b7558d072c21c40df", "controlled_test": false, "RUNTIME_MONITOR": "NOT_READY", "request_id_is_identity": false, "trusted_provenance": "UNKNOWN", "envelope_provenance": "RUNTIME_LOG", "reason_code": "MODEL_NOT_ACCEPTED", "feature_manifest_verified": true, "explicit_missing_value_count": 5}}, "frequency_hz": 2.4}
