{
  "schema_version": "1.0.0-proposed",
  "run_id": "run-f0c-0001", "request_id": "req-f0c-0001", "event_id": "evt-comm-0001",
  "producer": { "name": "comm_risk_mock", "module_version": "0.1.0", "source": "MOCK" },
  "observed_at": "2026-10-10T12:00:05Z", "status": "NORMAL",
  "reason": "窗口内请求数 3 次，未超过基线阈值",
  "communication": { "resource": "/rg/guarded_navigate", "resource_type": "Action", "operation": "GOAL_SEND" },
  "window": { "start": "2026-10-10T12:00:00Z", "end": "2026-10-10T12:00:05Z", "duration_ms": 5000 },
  "request_count": 3, "frequency_hz": 0.6,
  "anomaly_category": "NONE", "risk_level": "NONE",
  "basis": ["请求数 3 低于阈值 10", "到达间隔均匀，无重复调用特征"],
  "evidence_refs": [{ "ref": "N/A (mock)", "kind": "MOCK", "note": "模拟结论，不构成真实安全保证" }]
}
