{
  "schema_version": "1.0.0-proposed",
  "run_id": "run-f0c-0001", "request_id": "req-f0c-0001", "event_id": "evt-comm-0002",
  "producer": { "name": "comm_risk_mock", "module_version": "0.1.0", "source": "MOCK" },
  "observed_at": "2026-10-10T12:00:05Z", "status": "SUSPICIOUS",
  "reason": "窗口内请求数 120 次，为基线的 12 倍，且存在重复调用特征",
  "communication": { "resource": "/rg/guarded_navigate", "resource_type": "Action", "operation": "GOAL_SEND" },
  "window": { "start": "2026-10-10T12:00:00Z", "end": "2026-10-10T12:00:05Z", "duration_ms": 5000 },
  "request_count": 120, "frequency_hz": 24.0,
  "anomaly_category": "REQUEST_RATE_ANOMALY", "risk_level": "HIGH",
  "basis": ["请求数 120 超过阈值 10 的 12 倍", "存在相同参数的连续重复调用"],
  "evidence_refs": [{ "ref": "N/A (mock)", "kind": "MOCK", "note": "模拟结论" }]
}
